{
  "schema_version": "1.0.0",
  "evaluation_id": "P02-EVAL-001",
  "status": "completed",
  "preflight": {
    "status": "LISTO",
    "warnings": [],
    "blockers": [],
    "checks": {
      "artifact_readable": { "state": "PASS", "asserted_by": "HUMAN_REVIEW", "assertion_ref": "P02-CHECK-01", "checked_at": "2000-01-01T00:01:00.000Z" },
      "artifact_not_truncated": { "state": "PASS", "asserted_by": "HUMAN_REVIEW", "assertion_ref": "P02-CHECK-02", "checked_at": "2000-01-01T00:01:00.000Z" },
      "required_materials_available": { "state": "PASS", "asserted_by": "HUMAN_REVIEW", "assertion_ref": "P02-CHECK-03", "checked_at": "2000-01-01T00:01:00.000Z" },
      "response_matches_task": { "state": "PASS", "asserted_by": "HUMAN_REVIEW", "assertion_ref": "P02-CHECK-04", "checked_at": "2000-01-01T00:01:00.000Z" },
      "task_brief_semantically_complete": { "state": "PASS", "asserted_by": "HUMAN_REVIEW", "assertion_ref": "P02-CHECK-05", "checked_at": "2000-01-01T00:01:00.000Z" },
      "criteria_and_restrictions_disclosed": { "state": "PASS", "asserted_by": "HUMAN_REVIEW", "assertion_ref": "P02-CHECK-06", "checked_at": "2000-01-01T00:01:00.000Z" }
    },
    "confidence_limit": "alta"
  },
  "result": "REHACER",
  "result_confidence": "alta",
  "executive_summary": "La respuesta afirma que B es superior a A, pero no aporta evidencia para esa afirmación. EV recibe 0 y el dictamen manual esperado es REHACER por ausencia de la evidencia central requerida. El paquete está completo. Este caso sintético no acredita desempeño de una estudiante ni capacidad evaluadora automática.",
  "criteria": [
    {
      "criterion_id": "EV",
      "score": 0,
      "required": true,
      "findings": ["P02-F-001"],
      "reason": "El párrafo completo afirma superioridad y recomienda adopción sin aportar un dato que sustente la afirmación central; corresponde EV nivel 0 por ausencia de evidencia, sin atribuir fabricación."
    }
  ],
  "findings": [
    {
      "schema_version": "1.0.0",
      "finding_id": "P02-F-001",
      "criterion_id": "EV",
      "observation": "El procedimiento B es superior al A. La conclusión es sólida y debe adoptarse.",
      "evidence_locator": "submission.content, párrafo 1 completo (oraciones 1 y 2)",
      "comparison": "EV nivel 0: No aporta evidencia para la afirmación central o presenta evidencia fabricada.",
      "classification": "omisión",
      "severity": "mayor",
      "interpretation": "La respuesta completa no aporta evidencia para la superioridad afirmada. Se aplica la alternativa de ausencia de evidencia; no se afirma fabricación ni inferioridad de B.",
      "confidence": "alta",
      "remediation": "Fundamentar la conclusión con el dato de R1, su localización y su alcance.",
      "decision": "Asignar EV=0 y REHACER por no producir la evidencia central requerida, conforme a la Especificación §9.1."
    }
  ],
  "strengths": [],
  "priority_corrections": ["Fundamentar la conclusión con el dato de R1, su localización y su alcance."],
  "uncertainties": ["El dictamen se limita a esta submission sintética y no permite inferir capacidades de una persona."],
  "alternative_interpretations": ["La ausencia de evidencia en la respuesta no demuestra que B sea inferior a A."],
  "mastery_updates": [],
  "repair_task": {
    "required": true,
    "objective": "Sustentar una conclusión con evidencia localizada y alcance explícito.",
    "instruction": "Reescribí la respuesta usando el dato de R1, citá R1 y explicá qué permite y qué no permite concluir.",
    "success_condition": "La respuesta vincula su conclusión con las dos piezas de A y las dos de B, cita R1 y no afirma superioridad a partir de ese único registro."
  },
  "appeal": {
    "available": false,
    "rubric_frozen_at": null
  },
  "audit": {
    "evaluator_version": "manual-reference-P02-v1",
    "prompt_version": null,
    "rubric_version": "1.0.0",
    "timestamp": "2000-01-01T00:02:00.000Z",
    "model": null
  }
}
